服务很差，前台小姐根本没经过培训，我说延长一点时间退房---中午1点或2点都可以，居然跟我说超过12点就要加半天房费。全国5星酒店这是头一次碰到，一般1点退房都没问题。入住时候，酒店送足疗，号称价值98块，其实不值，而且服务很没档次，又做了其他项目，居然不能挂酒店账，要付现金，而且不给发票。补充点评 2008年7月17日 ： 看到前面有人投诉Taxi，我也想起了，司机拒载车号琼A-45153. 字母也许不对，但是号码没错。	n
在九江算是难得规模大点的酒店。国庆入住的，很是糟糕。早晨回房间时2个服务员在房间，其中一个在用厕所！见进人赶紧锁门，敲门让其出来，不理，出来时在冲马桶。投诉后，高个、瘦长脸姓吴的领班说担保他们的服务员不会用客房马桶。问他凭什么担保？答不出来。又说服务员是在用厕所电话打回家，我说早晨用厕所的电话是坏的，领班赶紧说服务员其实是用自己的手机。狡辩，恶劣之极！最后问我想怎么办。我说是你在解决问题，你怎么问我？你们酒店连起码的态度都没有！最后我告诉他，挂牌四星级的酒店服务员清理客房时不许关门，服务员用客人的马桶如何保证是消毒、卫生的？不想耽误当天行程，退房走人。房间的硬件只能说是模仿四星级酒店是设施，装修用的材质很差，从没见过挂牌4星酒店用这种廉价材料，去住了就知道了。	n
房间还不错，够大，不过床头有部分发霉的迹象，218元的价格还是太贵	n
千万不要去.重庆的朋友说是渡假型4星我就帮领导订了.现在肠子都悔青了.1.楼道非常窄,房间并无特色还是近5星的价格2.东楼居然是后面一个普通的楼改的,我去看了立马退了那个东楼的房3.服务还是比较满意,酒店硬件配套就差了.	n
首先12月份的天气晚上6点才开空调，半夜的时候居然空调关了，冷得要死。房间噶小，整个房间的灯也很暗。每层电梯人口处贴了可能是这家老总和在电视上露一面的人的合影的KT板，倒胃口。服务不专业，服务员从来是冷眼对客人，觉得爱来不来，号称4星，我觉得也就是2星了。床很硬，睡得我腰疼。补充点评 2007年12月18日 ： 早餐不好，也不知道第一个人为什么那样骗大家。	n
很不怎么样的酒店，根本不象三星级。1、大堂：受理很慢，且服务员连你好都不会说；2、房间：我订的是大床房间，电视机很旧，卫生间里洗澡的地方是用玻璃隔起来的，空间很狭小，而且热水放出来的里面全是棕红色的铁锈，洗澡时水温忽冷忽热；比较变态的是，房间里没有预备网线，你得打电话要，而且电源插座很不合理，如果要插笔记本电源，需要把电视柜往前搬至少50厘米，否则你是找不到插孔的；3、订餐：按照《服务指南》，我打了8003，提示无此号码，于是拨打8006查询，告知我打8033，打过去以后又让我打8031，订个餐有这么麻烦吗？好不容易打通了，要了红烧草鱼、清炒土豆丝和紫菜汤，结果巨难吃，还不如外边随便一个小餐馆做的好吃，反而花了70多元，根本不是三星级酒店厨师做的，让人愤慨！紫菜汤的颜色就像是刷锅水！紫菜也是大片大片的！3、服务：打电话要了网线，过了很久，难道绿洲饭店很大吗？要走那么久？！绿洲饭店我已经住过好几次了，这次是最差劲的！！！给各位推荐立达宾馆，性价比很好，服务也特别好，而且做的菜很有家常口味，吃起来很可口！虽然远了一点，但是打车到市中心，也不过7元钱而已。唯一不足的就是没有宽带连接。补充点评 2007年8月16日 ： 还有一点最让人无法忍受：隔音太差了！我的房间隔壁住了个醉汉，那个呻吟声和鼾声，简直就像在同一个房间一样，而且看电视的声音和说话的声音都很清晰！	n
由于在南京住的银河索菲特感觉不错，所以这次来成都退了喜来登到万达索菲特，接机的师傅和行李员都非常的不错，但接下来发生的事情让我觉得非常气愤，问前台要了两张房卡，一张是开不了门的，然后去大堂换了张并出去吃东西，可回来发现在前台换得房卡还是开不了门，在走廊里等了十分钟才由行李员拿了张新的房卡，进房间发现夜床没有开，然后打电话给房屋中心来开也床，最可气的是我的房间尽能听见电梯机器的声音，吵得睡不着，最后打电话给大副换房间，半夜三点钟拿着大包小包在换房间，这是由此以来第一次发生在五星级酒店的事情！！！宾馆反馈 2008年3月25日 ： 酒店回复：非常感谢您的光临和对我们索菲特品牌的关注。我们对您在饭店遇到的不快表示歉意，也向您对我们饭店服务和设施中提出的不足致以诚挚的感谢，我们将加强前台员工的培训和监督，使服务质量提升，把品牌做得更好。并衷心的希望您有机会再来饭店体验我们各方面的提高。	n
酒店位置还可以，离江边很近。房间因为没窗，所以很热，很闷。早餐不是自助，是份饭，不好吃。	n
订的2个房间由于一间空调是坏的，还生了霉，问服务员说没有其他房间了，让我们去退房。于是到了前台退房。第二天携程客服电话说我们订2间只住了一间，要扣掉另一间的钱(用信用卡担保过)。我说是房间的问题才退的，去找酒店负责人理论，负责人说我不管，你们只住了一间，不管退的那间。我说是服务员让我退的，他说服务员说的话无效。那个态度。。。于是，，，后面多少波折，，，，哎，差点误了回北京的车还好携程大度，调查清楚后免扣了多一间房间的钱	n
很一般的酒店……性价比一般……酒店是旧式房子，门感觉不太安全，洗手间相对来说还算装修的可以，只能算宾馆，不能称作酒店，隔音很差，环境很一般	n
入住两个晚上（5/30-6/1日），第一晚上被蚊子咬的无法睡觉，5月31日找前台换房间，既然还告诉我这房间是他们最好的，就是有点蚊子而已；离店时还无法提供发票，说是税务部门还没有批发票给他们（税务部门没批也可以营业吗？）。整体服务实在让人难以接受。	n
我是2月13号左右去的，定了一间大床房，在一楼，味道很浓的，像走进了胡同，12x房，有个窗子很小，连洗澡的拖鞋都没有，只有一双纸质拖鞋，我打了2次电话到前台，也没给送，最后我找到前台，服务员说他们没有洗澡的拖鞋，我只有从房间服务员那里又要了一双纸质拖鞋留洗澡，我们一家三口倒换着用（我孩子4岁）。有桌子，但不提供凳子，只能做床上打电脑。剩下的用的东西几乎没有：吹风机，电熨斗，。。。。。，感觉很不方便。一早起来走人，永远都不会在去这家酒店。	n
性价比太差，大堂不气派。房间一般，服务一般，以后不会住	n
看了前面的点评，感觉此酒店应该不错，所以这次去慈溪定了国脉酒店。结果大失所望。酒店位置不错，298的大床房窗外景色好，公园、小街... ...不满意的地方：一、房间太脏，地毯肯定二年未洗，污渍满地，如果像走道一样铺大理石反而干净得多；椅背、床背都不干净，房间居然还有一个大苍蝇；二、洗澡的花洒非常不好用，三、大堂的灯太昏暗，头晕！四、前台的服务小姐态度比较生硬；五、酒店所有的商务单人大床靠北边.但是低下是冷却塔,厨房烟道. 比较嘈	n
酒店分新楼和旧楼，我订的标准间在旧楼上，不得不说的是房间的设施实在太旧了，地毯已经看不出颜色了，因为住的时间短，所以就没有再换，还好床上用品比较干净。还有前台有一个服务员似乎不会笑，仿佛你来住店给她添了巨大的麻烦一样，我住了2天，每次经过前台都不自觉地看看她，从未见她笑过。真晕！	n
订了两次这家酒店,遇到都是几乎相同的问题,我在备注里写的很清楚,"不临街,安静,高层,不要KTV上的房型,"不知道什么原因,是携程没有把信息传给酒店,还是酒店的理解有问题,第一次给了我	n
海口的酒店特别便宜，这家也不例外。不过实际情况应该和价钱成正比，酒店设施比较旧，游泳池是户外的，特别小。下次不会再住了	n
这个酒店实在太差了,一进房就看到蟑螂.设施也差,电视不知道是什么时候的?按床头那些键,谁知道一按下去就整凹下去了.走道上的墙都已经潮了,连前台的布景也是破烂,是时候装修啦.	n
这个酒店就是因为在国贸边上,所以价格很贵.因为离我们公司近,也就算了感觉和那种200块左右的酒店差别不大,就是地段,别的没什么好说的电梯还不好....	n
酒店房间甲醛含量过高, 严重影响客人身体健康.我入住的是932, 刚开门差点被熏倒. 第二天回来开门再次被雷到.换房626, 情况稍好, 但床单上有三处污点, 退房时有和总台反应, 好象没什么反应.吃早饭, 你吃东西的速度要赶上服务员撤盘子的速度, 否则桌子上会什么都不会留下.补充点评 2008年7月6日 ： 哈, 刚住完,酒店价格就从450降到418, 下次和携程"砍价了"	n
介绍说酒店是座落于北四环的北苑路，结果晕我。该酒店位置偏僻，再走几步就是五环了，怎么会是四环？？第二天一早等半天也没有出租车来，只有走到大马路边去等，还是没有。冷得要命，最后没有办法，有一黑出租问我走不走，只有坐上车走了。房间还是不错得。	n
真是非常的不爽，本来来慈溪很喜欢住这里的。因为这次来的时候没有带本本，所以住了行政双人间，6楼真的是太差了！！！！！晚上房间温度有29度，空调竟然不开！！！窗户打开，对着外面就是一个汽车货运站！跟前台说换一下房间，竟然直接说，另一面就是马路！！都是很吵！！真的是太太失望了....换，坚决换，下次肯定不住的了。补充点评 2007年5月16日 ： 实在没有办法，共2间住了2天，真的想连评4次，都给个1分，太气愤了！！破网络也是一塌糊涂。	n
这是一家住宿房间设施极差的度假村，我提前在携程网订了一间5号楼的房间，但是，当我入住时前台因为没有房间，竟然说没有接到订单，然后给了6号楼，空调很响，隔音又差，隔壁房间的一举一动都听见，原计划住两天，吓得第二天赶快逃。离开后发现，其实附近的好的宾馆还是不少的。不过度假村的环境在当地还是可以。	n
27日入住正赶上附近施工，第一印象不好，29日离开时，大厅有钢琴小提琴的表演。订房时（大/双）没得挑，入住时被告知是两间豪标双人间，其实想要一大一双。总之不尽如人意。	n
位置不是很好，离泰山脚下比较远。房间3楼不靠街道的那面较好，虽然后面有市场，但是双窗，关闭后噪音还好。靠街道面的噪音很大，特别是二楼。附近吃饭的地方很少。	n
个人认为携程推荐此宾馆是不注重会员的基本利益。该酒店一半房间临大马路，晚上很吵，使人无法入睡。每次预定，该酒店总是声称无法保证安排安静和有宽带的房间，明显不重视携程的客人。本人已在该酒店经历了多次可怕的预订过程，携程的协调能力始终使客人深感失望，希望携程在赚钱的同时真正为会员的利益着想，不要推荐这样服务死板的酒店，本人今后决不入住该酒店。	n
太潮了，根本不是人住的！价位倒是不高，但是携程价没有竞争力！	n
强烈建议携程把它剔出去。前台的服务员好像来自人猿星球，如果你不催促可以让你等上1个小时不理你。入住和结账时老夫不得不大发雷霆才算搞定。房间简陋，早餐差，夜总会的音响扰民。服务水平0分以下。十分怀疑前面的打分者有托儿。补充点评 2008年4月23日 ： 老夫是一个温和的人，这一次是第一次大发脾气。实在是忍无可忍	n
卫生间特别小。内部设施不人性化，尤其烧热水的设施明显接触不良，且他后面的插线板在下面，不方便使用。	n
单人间太小了，居然要350元/天，杀猪呀！	n
酒店的环境也不算差，价格也比较便宜，但是我建议不要去住这个酒店，我住的是高级海景房，房间相当的小，设施也很陈旧，房间里的空调噪音很大。如果我在去，我不会选择这个酒店入住了	n
酒店的设施和服务与描述及其不相符硬件最多2.5星水平，卫生状况一般，床单上有洗不掉的污渍，床上有沙粒（？？？！！！），房门不隔音...早餐只有泡饭和咸菜，而且每人只有1小碗，因为添加的话，后面来的客人就连泡饭也吃不到了。虽然是春节期间，但这样的服务也太匪夷所思了。我以前通过携程预定过全国各地的房间，发现有夸大星级的情况，但还不算离谱。携程网上酒店的描述和酒店实际质量差别如此之大，我是第一次遇到。德清的雅兰和荣盛山庄的硬件和服务要好几个档次。据我所了解的携程操作程序，网上酒店的说明和照片是酒店自己上传的。我建议携程适当做一些抽查和复核，类似卢球假日这样的情况，会极大影响用户对携程的信任，虽然信息资料是酒店提供的。	n
挺悲哀的,住的是双标间国庆是230,在杭州住了个锦华之旅已经很挫了,这位仁兄有过之而无不及,依然的一阵阵怪味,纱窗坏的,空调乱叫,唯一的好处就是代售附近的景点(如:浙西大峡谷,天滩,大明山等)门票八五折,本身在携程订的是两晚,连忙把第二晚的给退了,听当天把我们带到天滩的司机介绍住在大峡谷镇的一个旅店.	n
酒店服务不行，尤其是餐厅服务人员。房间较冷，没有暖气、电话。不方便。免费注册 网站导航 宾馆索引 服务说明 关于携程 诚聘英才 代理合作 广告业务 联系我们Copyright1999-2008, ctrip.com. all rights reserved.	n
相对来说，比起东莞，深圳的酒店，该酒店服务质量还是略有小疵。略欠热情与礼貌，有点爱搭不理的。举个例子，在该酒店住宿的最后一个晚上，他们忘了给新拖鞋，我总共打了三个电话，才送过来，当时看酒店环境，似乎并不是非常忙碌。	n
我是带孩子去的.电视画面一打开就是不堪入目的镜头.怕孩子乱摁,只有把遥控器藏起来.作为五星酒店怎么可以象街头旅馆? 酒店应该反思一下.	n
综述:见过差的四星酒店,没见过这么差的准四星酒店.详细描述:1,基础设施问题:酒店承诺可以宽带上网,但房间经过更换,才可以使用.房间设施比较简陋.和四形标准有一定差距.具体表现在:家具陈旧,没有必要的办公用具.床具不是一般的硬,而且有明显的污渍.2,服务态度问题.到达酒店时,门童没有服务意识,不仅不帮助客人拿行李,而且开门的意识都没有.总机接线员不仅不使用双语,而且连基本的礼貌用语都没有.3,安全保卫方面问题:酒店防火安全意识不够高.首先,酒店房间内的插座和电源按键安装不稳定,部分地方有明显松动的状况.其次,在酒店3--4层的安全出口的过道内铺设了地毯,根据消防法的内容,酒店安全出口的过道内是不能铺设地毯的.保安并不尽职.4,餐饮问题.酒店早餐没有水果,这是我以前住酒店从没遇到的.没有就没有吧,但是,酒店独出心裁,把塑料水果放在餐台上,不知酒店是考察客人的智商还是工作人员失误.以上就是入住此酒店的感受,但此酒店不是一无适处,酒店门口有轻轨,交通还算便利,距机场较近,前台的一位接待人员和电脑工程师值得表扬.如果你不追求享受,如果你可以忍受没有网络的日子,如果你可以对酒店服务质量不做更高要求,如果你可以保证你入住其间,酒店不会发生火灾.我推荐您入住此酒店.	n
房间太脏,竟然没有热水,本楼服务员说锅炉坏了修理不了,.我要求换房间,既然回答说全部三个楼都没有热水,明显骗人!还说没有空房间了.我说那我搬走不住了,明确告诉那两个自作聪	n
除了环境比较好，在云龙公园对面，酒店设施太旧了，价格高，性价比低，在这个天气，房间里竟然有好多蚊子，半夜被蚊子打扰几次	n
像是仓库改的拖鞋不错卫生间还可以早餐很差	n
宾馆比较差，我估计是有二星升到三星的。硬件差还可以忍受，前台服务差就让人难以忍受了。前台的服务很差。一个叫张红梅的女服务员，态度极其恶劣。我已经口头向大堂经理投诉了。希望下次去的兄弟姐妹们不要碰到这么一个人。补充点评 2007年12月2日 ： 宾馆比较差，我估计是有二星升到三星的。硬件差还可以忍受，前台服务差就让人难以忍受了。前台的服务很差。一个叫张红梅的女服务员，态度极其恶劣。就算我在大街上碰到一个人也比她的态度好．我晚上到了前台，等了很久后（她一直在弄电脑，我不知道在干什么）才不耐烦的冲我说你是干什么的？！！！！！我只好很小心的说住宿啊．然后就是很不耐烦的帮我办理手续．退房时又碰到了这么一个上帝，态度差的你不敢想象，好象我和她有什么深仇大恨．我已经口头向大堂经理投诉了。希望下次去的兄弟姐妹们不要碰到这么一个人。同时希望宾馆能给我一个回复．ＣＨＵＮＬＩＮＧ２１９＠ＳＯＨＵ．ＣＯＭ宾馆反馈 2007年12月10日 ： 关于您反映的情况，客房领导高度重视，立刻召开总台员工及所有管理人员专题会，对当事员工进行了批评教育及再培训。保证在今后的工作中提高服务质量，树立“以客为先”的服务意识，努力做好对客服务工作。我们再次真诚的向您致歉，并期待您再次入住镇江大酒店。	n
该酒店根本就达不到星级标准,是当地工商局办的,估计就是原来的招待所,前天晚上我刚住了一晚,室外-3度,室内温度不会超过10度,更晕的是晚上12点空调关闭,网速很慢,按当地的消费水平,标准间最多就是120元的水平,可携程的预定价是180元,不值!早餐很差!	n
我住的是大床间，房子不算干净，卫生间比较简陋，早餐品种太少，饭店上菜太慢，卫生也是问题，不停有苍蝇转来转去。下次不会再住了。	n
酒店前台服务很差！开了房间，进去一看，竟然有人入住了！还好没出什么事！要出什么事那谁负责呢？找前台领班反映，领班一变骂服务员一边给我换房间！脸上连笑容也没有！好象是我们顾客犯错！不知道搞什么鬼！给携城打电话投诉，携城的态度很好！酒店经理打到房间来赔礼道歉，还是找什么客观原因，说什么是服务员太忙了，出错！这个好象是低级错误吧！而且还说补偿一份早餐！态度生硬，好象我是属于那种住的起酒店，吃不起早餐的人！跟她们闹，就是因为我没钱吃早餐！真是气愤！不建议大家住这个酒店！	n
价格在贵阳算便宜的，不过房间太旧，够大，空调暖风白天不开，生气！	n
房间的风景挺不错，望出去就是条古运河，很有古诗词意韵。但房间里的淋浴设施不好，淋浴门关不紧，水龙头出水很小，洗澡很不舒服。电视有两个遥控器，用起来很不方便。最主要前台小姐服务很不好，冷冰冰的，尤其是那个脸蛋胖胖的小姐，脸上象涂过糨糊一样，一点没有微笑。我去CHECK IN和CHECK OUT的时候，感觉很不舒服。感觉服务生的培训有待加强，服务意识太差！！！	n
房间卫浴水准太差，面盆的下水是坏的，居然要用手去把下水给抠出来。。。衣橱的灯的开关是坏的，把门关上灯还亮着。卫生间里粘两个灭蟑螂的盒子，让人看了很不舒服。	n
房间的硬件设施一般，就是淋浴太差，洗澡很不方便。另外，服务也不是太好，房间卫生打扫的不太干净，前台人员业务水平太低，只有一人知道如何刷卡，其他人都不懂，发票中奖金额5元10元的按照规定在发票开具处兑奖，但是这里不论金额多少都不能兑奖，也不解释原因，让人很气愤。总之以后我是不会再去这个酒店了。	n
感觉不是太好，也许前台是看了其他网友的点评吧，感觉一直都在对顾客假笑，令人毛骨悚然。订酒店后还特意去问了一下说是从早上6点就可以入住并不加收房费，可是到酒店之后前台却说要等到12点才能入住。好不容易等到12点40分入住了，才发现前台给的405房间里面住着其他的房客，而前台居然一直都不知道。还有房间的被子上有超级多的毛发，太恐怖了。	n
这不是星级酒店,而是一间很差的招待所. 早餐很	n
总体来讲，对登封的印象比较差，基本上是脏乱差的典型！酒店的设施极端简陋，洗手间里连浴帘都没有，洗个澡满屋子的水！而且，没有挂衣服的地方。酒店里的餐厅，竟然不到7点去就已经黑灯瞎火了。总之比较阴暗老旧的酒店，条件很一般。不过，地理位置不错，对面是超市，还有小吃一条街。	n
太偏的地方，太冷清的场所，太糟糕的早餐。郁闷！！补充点评 2008年4月18日 ： 建议携程不要推荐过去了	n
一个字：差、差、差，态度差到极点。我们从7月22日住到7月27日，开了两间房，如果不是因为工作太忙，懒的换房间了，早就不能忍受了。第一天入住感觉不错，房间也还干净；随后后面几天，事情接着来了。一、就是我同事的衣服放房间里不见了（其他东西都在），问他们怎么回事，结果这个推那个，那个推这个，后来不了了之，最后还是没找到。二、我们房间没有靠枕，问服务员要一个，服务员说没有了，我就说去其他房间拿一个，服务员后来说领导没有批准，他们也不能动其他房间的，只能帮反应，后来也不了了之。三、床单、被套我们睡了四天了都不给我们换，后来还是我们主动提的，结果提后还只换了一张床的。四、最气愤就是这了，憋了几天的气终于爆发了。我们最后一天吃早饭，由于起的晚，我们就打算早餐、午餐一块吃（由于赶飞机），那个小餐厅老板很不错，说午饭没好，我就给你拿点剩余的早餐还有马上炒个菜，只收我们早餐卷就好，要我们问前台要餐卷，前台说不给，说早餐时间已过，我们就说，餐厅都愿意，你凭什么不给，后来我就火了，今天我就非要了。结果那个大厅经理（样子好象），既然给我拍桌子，最后没办法就说“给他，给他”。后来我问酒店餐厅老板，为什么他们服务态度那么差，怎么象国营的一样，小老板说“本来就是国营的”，在这看到吵架是常事，我说难怪，发誓再也来了。后来我还给携程客服部打电话，建议不要给客人推荐这样的酒店，简直受气。	n
是拿原来一栋老楼改建的，装修很新，但房间内地面没有地毯，感觉冷冰冰。隔墙隔音很差，晚上被隔壁做爱的声音吵得没法睡。电视频道太少，只有5个。网络带宽太小，只能收发电邮，下载东西简直是做梦。价格还算便宜。	n
这酒店的管理实在太有毛病了!10.22号通过携程订1晚.等要续房的时候说房间满?!!没有任何提前的告知,人还没走就把房间租给别人？!	n
房间装修差设施也不好,早餐很一般.位置偏僻.	n
酒店设施和汉庭差不多，但电视不是液晶的（住别的是），酒店旁边比较荒凉，推荐住陕西路附近那几家。但我入住那天的服务员的素质太差，会员卡都办不明白。应加强对他们的基本素质培训。补充点评 2008年5月7日 ： 携程的价格实在没有竞争力，可以考虑入汉庭会	n
酒店周边比较繁华，对面有必胜客。服务热情还可以，设施就不是一般的差，第一个房间网口坏了不能上网，换个房间，水蓬头不出水，郁闷，各位还是不要去了。	n
超乎寻常之差，怎么评的三星不知道，按说就那设施水平连县级招待所都不如。房间巨窄，洗手间就纯一厕所，连个放物品的台子都没有，地漏巨容易堵，刚洗5分钟就水漫金山。总之，设备过于陈旧，建议各位驴友切勿上当。	n
就住了两天，第一天晚上就发现了一只大小强。第二天下午回来让服务员喷了药，早上起来发现了一只殉职的小小强。早餐没有牛奶，勉强可以吃几片廉价的面包，喝点豆浆，冲的果珍，白粥。别的反正我都不感兴趣。房间临街，晚上剧吵，幸好俺睡得比较死。	n
