7月21日就提交了订单，结果7月26日我们其中2个朋友先行到达酒店，他们由于2人中一位未带有效证件，结果前台足足让他们等了一个小时也不给他们解决（据前台说是7.25接到公安局的通知，每位住店客人必须提供证件），本身恰逢奥运期间公安部门提出这样的要求，我们作为中国公民全力配合也无可厚非，但是酒店的几个作法实在是让我们无法忍受：1、7月25日晚我们曾经致电酒店，但是酒店根本未提醒我们有如此新规定，同时在我们提交订单近一星期内也未有酒店或携程事前通知我们；2、我们2位朋友足足等了一个小时后，我们也赶到了酒店，又把我们晾在一边达1个多小时，只顾给其他客人办理手续，不给我们提供解决的方法；3、作为号称6星级的酒店，此事件自始至终前台人员未见到笑脸，似乎错全在客人这边，难道号称与国际接轨的6星级酒店就是这样培训员工的；4、我们要求酒店提供公安部门下发的相关文件，结果前台人员回答，是公安部门电话下达的，酒店没有文件，作为一名有稍有常识的公民，在当今这样的信息化时代，政府部门都遵循信息公开的原则，若真有诸如此类的文件下达，也不至于会如此不正规操作把，故此我们十分怀疑酒店的说法。5、在于酒店交涉后，酒店人员竟然十分蛮横的回答，如果我们不能按照他们的要求做，就不接待我们了，鄙人实在对“半岛”品牌的规范度、信誉度感到十分震惊，室外是高达40多度的高温，我们是驱车2个半小时才到达酒店的，难道真正的“半岛”集团酒店会如此对待他们的客人。（后得知此半岛是盗用香港半岛名称，不知香港半岛酒店管理集团得知有这样的“李鬼”兄弟会做何感想，也不知当地工商管理部门是如何会让这种水准的团队使用享有盛名的“半岛”品牌的）；6、期间有一位身着经理服装的女士出来接待，都是说2句话就跑开，号称去请示上级，一请示就是15、20分钟，真不知这位经理是什么级别，更有甚者，此位经理还出言不逊，说出门带证件是常识问题，我们斗胆问一句“那信息提前公开告知”是否就不是常识问题了，似乎我们都是些没有常识的人，似乎我们这些没有常识的客人是不配入住这种“高贵”的酒店的，这是对客人的极度不尊重，是对我们客人人格的极大侮辱。7、我们本着息事宁人的态度提出从上海将证件传真至酒店，请酒店先行办理check in手续，结果前台也是出尔反尔，一会说可以，一会又不行了，最后也是在我们态度强硬的情况下，足足耗了1个小时后才满足了我们这群饥肠辘辘的客人的基本要求；8、check in手续办完后，突然又说只能给我们2个房间，说其中一个房间还在打扫，我们看了时间，此时已是中午12点35分了，按照国际管理，当天客人入住最晚应在12点，我们实在是对此酒店的服务水平大大怀疑；9、我们预定了泳池湖景房，结果根本看不到湖，真不知这个湖景从何而来；10、凌晨4.：45分，竟然有2位男客人到泳池游泳，影响到我们根本无法入睡，酒店竟无一人前去劝阻。归于以上种种（还有许多细节不满之处不再一一叙述），我们真诚的对携程网提出我们的建议，此种水准的酒店以后真是不要再推荐了，一来使客人遭受折磨，二来也大大有损贵网站声誉！补充点评 2008年8月2日 ： 对于该酒店不负责任，缺乏诚意的反馈，实在是有愧于挂出的“六星”标志,我十分赞同楼上朋友的点评“对不起这六星，这家酒店没有管理好，希望下次可以看到新面貌！”：1、酒店既已承认25日就接到公安部门通知，却给予携程网的客服人员26日上午才收到通知的信息，不知如此欺骗公众的酒店如何生存；2、请酒店再次调出当日的录像资料，请你们公司全体高层好好学学什么叫微笑，好好培训你们的前台，你们的前台脸上出现过笑容吗？3、明明是我们的朋友自己提出传真身份证件，而前台一会说可以，一会又说如果没有证件恕酒店不接待，现在竟然变成了酒店总经理决定的事情，那我们只好在此感谢贵酒店总经理的“真诚服务”了；4、请酒店尊重我们的公安部门，难道我们的公安部门作为国家执法机关，会如此不规范、不严谨吗？（前面承认接到指示《凡是入住酒店的客人均需出示身份证登记，否则将对酒店和相关工作人员以及住店当事人均要做出特别时期的严肃处罚》，很明确的使用了书名号，后面又说公安部门不会为此发文，不知酒店如何自圆其说？）5、另外自始至终就是那位不会笑的前台小姐接待的我们，不知酒店所谓“前台其他员工从何而来；6、自己也承认自己是“1881半岛”，难道半岛前面加个“1881”，就和香港九龙“半岛酒店”是一脉相传吗？酒店都不知要尊重客人，却指责客人不尊重酒店，对于酒店如此“真诚”的反馈，我们只好在此很真诚的回复贵酒店，我们是再也不会享用该酒店的“六星”服务了！也奉劝贵酒店，诚信是生存之本，切记！宾馆反馈 2008年8月7日 ： 针对你26日入住时无法正常出示身份证登记的情况，酒店方查看了当日录像全过程，并对所有当事人进行了全面调查。奥运会即将开幕，为了确保奥运会及全国人民的平安，25日我们得到公安部门的紧急指示 《凡是入住酒店的客人均需出示身份证登记，否则将对酒店和相关工作人员及住店当事人做出特别时期的严肃处罚》。对应您提出的意见，酒店慎重做出以下答复：一、 7 月25日 公安部门强调了必须出示所有住店客人身份证登记的紧急指示，而作为公民入住酒店是必须携带身份证的。这一常识。不需要公安部门做任何发文！希望你懂得。二、你朋友 11:40 进店至 12:25 Check In 手续办好，共 45 分钟，和你说的等待 2 小时多不符。正因为我们尊重客人，所以当你和你朋友在大堂吵闹时，我们前台其他员工非常礼貌地为其他住店客人快速办理了 check in 。三、无锡 1881 半岛酒店隶属香港 1881 半岛酒店集团公司！再次声明！！ 四、我们 1881 半岛酒店、可能会对极少个别客人不“尊重”，其目的只是为了更好的尊重服务于其他客人，为其他客人提供更好、更高品质的服务环境。当时相关经理的出现正是想尽快解决问题的，也是在她的协调下，在 45 分钟的过程中解决了你们的问题。没有一点不尊重你们，更谈不上出言不逊。五、酒店零距离泳池房在你入住前一天是客满的，你预定的房间必须是前日客人退房后(入住 1881 半岛酒店客人享有住房保留到 14:00 退房的权利)才能提供给你。我们不可能会因为你的到来，而提前把前住店客人推至门外！按照国际惯例(ctrip的公开公布):14:00 是你的入住时间，酒店尊重并遵守了此惯例！六、诽谤及诬蔑是不道德的，1881半岛酒店所有零距离泳池房，都能透过泳池清晰看到全湖景！！其主要特色是客房与游泳池紧相连，也是目前国内最前卫的设计理念。七、对于凌晨有客人游泳，我们也做了相应的调查，有 2 位住泳池房的醉酒客人，未按照酒店规定时间游泳后，不到 5 分钟便由保安劝慰回房了，在此深表遗憾。针对你的补充点评，我们做出如下反馈：一、我们酒店实行不卑不亢的微笑服务标准，深知微笑服务的重要性，但是，我们的微笑只会给予值得尊重的客人。二、我们在奥运会期间严格执行公安部门指示，希望你们不要玩一些文字游戏，打书名号只是为了让你们跟上奥运步伐、更清楚的认识到：非常时期出示身份证的重要性。我们真诚欢迎并保护好每一位有素质、有品味的客人，并提供舒适安全的服务环境，反之 ……	n
第一次给一家酒店1分，是因为它挂着四星的牌子。虽然价格在江阴的同级酒店算便宜的，但它确实是我住过的最差劲的四星级酒店。建议把四星的牌子先摘掉，从二星级的某些方面开始做起，然后向三星级看齐，等到所有三星级标准都符合了，才把四星的牌子重新挂上。空调得弄一弄了，实在太吵了。卫生间的设施，就算不换新的，也得弄得给人感觉不会太旧，居然有些地方还发黄了，就连上海路边的公共厕所都不会比它差。房间？也就二星级的水准，糊弄客人也不是这样糊弄的啊！	n
头一天订的是标间（大床）房，结果大床不大，两个人太拥挤，房间也太小。最不能容忍的是马桶居然和淋浴在一起，高的湿乎乎的，很不方便。第二天换了一间双床标间，房间倒是宽敞了许多，没想到的是楼下歌厅唱歌没完，搞到12点睡不着觉，这样的宾馆谁还敢住？	n
见过差的四星，没见过这么差的四星。千万不要住，晚上还有骚扰电话	n
位于友谊路金融街，找不到吃饭的地方。酒店刚刚装修好，有点气味，我能忍受，同事不行。酒店、楼下餐厅、酒吧、日式料理都是科技大厦单独承包出去的。入住的时候还是第一个月试营业，宽带很不稳定，打电话报修居然以正处试营业期来搪塞。没好就不要让客人住嘛，强烈鄙视这一点。	n
我16日入住802房间，整个晚上均有隆隆噪音，即像电梯，又像楼上在作移动家具的体育锻炼。坐起来听又不明显，头一挨枕头又像枕在音响上，一夜没睡好，本来预定3天，第2天早上赶快逃跑。宾馆反馈 2008年1月22日 ： 非常感谢您给我们提出的宝贵意见。由于酒店当晚紧急工程抢修给您造成不便请谅解。房间如有任何问题，请致电酒店前台，酒店前台将竭诚为客人服务；欢迎您再次入住中南海滨大酒店并提出宝贵意见。	n
ctrip标上四星,但只能用金玉其外败絮其内来来形容,这件酒店外表好看而已,内部最多和如家或者7天这些廉价酒店打平手,我住过所有星级的酒店,就是这间最不符合4星的标准,如果以北京的北方佳苑和广州的华夏酒店为标准4星参考,他在我眼里和街边的小酒店没差别,我真的不知道他的四星从哪里来,前台态度差劲,连最基本的笑脸迎人都没有,酒店3楼的餐厅更是差极了,而菜单里没几样菜有的,摆明砍客,还摆出要嘛被砍,要嘛就别来吃的样子,菜的味道更不敢恭维,我第一次入住酒店后马上再出去找酒店的,紫光的位置也不太好,连沙滩都不能直接进去,建议去阳江的住南方假日酒店,服务态度好多了,而且前面就可以直接到沙滩,靠山面海,真正的海景房!或者就是住我第二天入住的小港湾山庄,这是在悬崖边的,晚上可以在小亭子听海喝喝茶也不错,离酒店不远就有一间旺角海鲜大排档,除了海虾,其他的都比外面便宜太多了,鱼虾蟹随便叫!这两间都是真正的海景房,标三星也非常符合,重点是这两三星都比4四星好太多了,所以建议大家千万不要入住所谓的阳江最好最高级的4星紫江,花钱买罪受!	n
前台包括服务餐厅的前台都很不客气，好像我们欠他们钱一样，爱住不住的意思，没有一点受到尊敬的感觉	n
住过的最差的4星级宾馆，墙壁根本不隔音，晚上楼下卡拉ＯＫ吵的没法睡觉，早餐餐厅都是附近过来喝早茶的老头	n
我们7人同行，订了2间标房，1间三人房，到酒店入住时告知三人房与两间标房分别在两幢楼的，三人房check in的时候又告知房间有问题，还要给了我们两间标房，房间内设施齐全，但是洗澡水放出来就象泥水，要放15分钟才干净，楼内服务台没有服务人员，总体感觉不是很满意。	n
楼很老,房间很大,服务不错.二楼的早茶不错.	n
我端午节期间带家人入住了一晚，感觉服务比较差，根本达不到四星的标准，下面我从硬件和服务两方面做一个点评：一、硬件1、酒店位置不错，比较繁华；夜间很安静(我入住的是东楼)；2、酒店房间很小(特别是卫生间)，和香港的酒店有得一拼；3、房间衣柜没有门把手，打开很费劲；4、席梦思床垫很软(好的席梦思应该比较硬)；5、房间隔音不好，我入住的当晚，隔壁是间婚房，很多人在闹房，声音很清楚；二、服务1、房间里没有准备牙刷，我拨打分机16要求提供，接线员竟然让我拨打其他电话去要(酒店入住卡上清楚写明有要求直接拨打16就可以了)；2、去二楼中餐厅就餐，服务员告知中餐厅当天搬到一楼鲍翅馆了；转到一楼鲍翅馆，服务员给了一份鲍翅馆的菜单，我问服务员要中餐厅菜单，这个服务员竟然说没有，我问道，中餐厅都搬到一楼了，难道菜单没搬下来么？这时服务员才不情愿的把中餐厅的菜单给我；3、因为是通过携程预定的，送了20元积分卡。在就餐完毕后，我们把积分卡给服务员，由于这个服务员已经把帐单打印好，不想重新打印，竟然说你们下次再来用好了，我们是从外地过来的，下次不知是猴年马月了；4、第二天早上去吃早餐，由于小孩(16个月大)不肯吃早饭而哭闹，服务员竟然过来对我小孩说，再哭就打屁股了！这句话我们当父母的可以说，但是你们酒店服务员绝对不应该说，希望你们道歉！5、就餐完毕来去，走到餐厅门口时，服务员用眼睛瞟你一下，连招呼也不打。住了很多四星、五星，从来没见过这么没礼貌的。宾馆反馈 2008年6月17日 ： 对于您在住店期间发生的不愉快,我代表酒店真诚的向您道歉.非常感谢您对我们提出的意见和批评，我们也把您所反映的问题反馈到了相关部门，进行了培训和整改。我们希望能有机会再次会您提供服务，相信一定会让您有不同的感觉。	n
早餐有还不如无！这傍边就是长途汽车站，可想而知这外面的环境是个什么样子！住在这里的人更多的是中转旅客的样子，我见过尼姑，和尚！房间设施也就比招待所好点的样子，比较旧的酒店，名字虽然很时尚，但是酒店真的没有可比性。有个米兰俱乐部，估计是happy的地方，还有个桑拿按摩的地方，这个不用我多说大家也晓得是干吗的，每天晚上10点准时房间电话响起，招不招就随你了。大家自己掂量着吧。	n
我是冬至这天入住的，到了酒店就浑身不舒服。酒店有2个门，感觉很怪异，电梯里的灯是暗暗的，我住商务房，一进去就感觉有寒意，怎么看怎么不舒服，后来就换房了。和我一起的有6个人，其中4个和我一样感觉很怪异，后来我们都不敢单独睡，要了双人房睡。客房的设施也是给人很压抑的感觉，电视机柜象个大箱子，仿佛随时有人从里面走出来。柜子和床头各有2个大大的黑色圆球，好像眼睛盯着你。一个同事说，她房间的灯罩居然是黑色的，灯光一直很暗。	n
服务不好！服务意识非常烂。订的双早房间，结果早餐只给了1张，吃早餐时被告知 自己去找前台，态度生硬，好像客人都是骗子似的。结果早餐非常简陋……酒店的导游100元一天。在景点时总是催促你快点……，总是带你去一些需要你花费的地方，比如烧香（烧高香）、算命、请护身符、开光……，动辄几百元、甚至几千元…… （但是本人坚决不买！）	n
此酒店涉嫌欺骗：ctrip上显示行政房免费上网，但是实事并非如此，只有去行政酒廊去上网才是免费，房间内上网要收费，每分钟2元，而且如果去行政酒廊上网，前提要你在房间先上网激活帐号才可以。也就是说你最少要花两元才能上网，而且不再房间内，这个不是欺骗是啥。早知如此说啥也不会定在这里，1400多的房费，住那里不比这里好，就是想上网。其他服务实在一般。距离市区较远，出行很不方便。周围设施少，同等价位酒店市里多了去了，下次不会住了，还有早餐实在一般。check in速度慢，有老外提问题，就放下和我check in的事情过去搭理人家，这点让人感觉很差。check out也是拖拉。	n
1月7日入住，太一般了，对于2星降到1星或没有星级也就这样了。服务很差，服务员不知房内有客，未敲门竟直开门进入房间，要吓死人的。更痛苦的是，说是酒店，连饭都没地方吃，我是中午住进来的，没到晚饭时间就退房走人！	n
距离机场还比较近，但是客房是点式住宅式的，丽景房房间非常小，卫生间马马虎虎，热水还不错。房间设施及装修感觉均比较陈旧，卫生状况一般。号称的室内恒温游泳池不开放，我游泳衣都带去了。晚上一直有客人在旁边房间吵闹，总的环境较差。	n
从来没花500块住这样的房间..........1.朝着轻轨,不能睡懒觉2.隔音不好.楼上还是哪里似乎有舞厅,很吵闹3.床很硬,很硬4.房间很小最让人受不了的是,5月的上海,天那么热,发现没有冷气,电话问服务,答曰:对不起我们是中央空调,现在还没接到通知开,有需要的话,我请服务员送个电风扇给你......我没接受她的建议,于是一夜闷热.....非常不满意这家酒店	n
经济型酒店虽然没有太高的要求但房间实在是太小了，很有种做牢的感觉，如果是无窗的房间那就更糟糕了，建议大伙不要住无窗房。	n
晚上没完没了的骚扰电话，让人真的不敢恭维补充点评 2007年12月14日 ： 我打的都是1分，怎么平均出来是2分？莫名其妙	n
最大的优点也就是价钱比较实惠，另外有免费停车场（如果住在古镇里面，白天是不允许把车开进去的）。这个宾馆的服务员都说自己的餐厅做的当地小吃好吃，实在不敢苟同，份量少，味道也不地道，价格却不低，建议重视当地美食的朋友不要在宾馆的餐厅就餐，会对山西的小吃产生错误印象的。	n
在预定时间到前台进行登记时，服务人员告诉我们：XC没有进行预定，后来通过多次电话......，另外，预定价格和门市价格只有4元价差......	n
房间很差,有浓重的烟和潮气的混合味道.我的所有在房间里穿过的衣服都有浓重的味道,尽管我只住了两晚.床也是又硬又小,卧具也很低档,电视更是老旧不堪,像是十年前型号,而且信号极差. 早餐品味很低,像个招待所的风格.餐厅里面黑乎乎的,令人感到很沮丧. 其它地方印象不深.总之,这样的酒店挂牌5星实在是让人难以理解.	n
一个字,烂,二个字,特烂,三个字,特别烂.这样的宾馆四星级?请携程别为了回扣向我们推荐垃圾宾馆.	n
离海边很近，但是房间的装修已经不是很新（海景房，1号楼），老式的宾馆，老式的服务。适合要求方便，但对房间设施不挑剔，要求不是太高的朋友补充点评 2006年9月3日 ： 比较过分的是所谓“海景房”（还要多加90元的）外面竟然首先是个堆放垃圾桶、扫把、拖把和打扫卫生者晾晒裤子的晒台，之后是个树林，再远处才是海，不知道这样的房间叫“海景房”合适不合适？；房间内霉味较重，打开窗户跑味半天时间也用处不大，个别墙壁角落处有霉点；床单、被褥的洁净程度很一般，比小旅馆还是要强，床看起来不是很平，但是睡着还凑活；枕套两套，上面的还算白（但是有洗不掉的污迹），下面稍灰；刚进入房间后不满霉味和所谓“海景”提出换房，当值的中年男人推诿多次无果，答应有退房的换，后来竟然告知一天都没有人退房。管理水平很一般，当然是和类似的小地方比，办手续的速度很慢，前台电脑里没有管理系统，竟然用的是word，好歹用个excel吧！这种管理落后的宾馆建议ctrip除名，要不以后怎么让人相信你们？	n
晚上到的酒店，大堂灯都关了，来客人还舍不得开，打手电开的房，绝了！前脚刚进房间后脚按摩电话就打进来，牛叉！社会主义好啊！	n
酒店装修气味很浓，房间感觉一般，与4星有不少差距。入住期间居然不开空调，热得要死，刚好房间又向阳，期间打了几次电话，最后同价升级成单人套房，郁闷的心情总算好点！卫浴品太旧给人感觉不爽，总之感觉不好，下次不会再住！！	n
外观脏兮兮的,坐机场大巴路过时,还不知道自己住的就是这间如家,心里还说这么破啊.下了大巴走过来,才发现自己要住这里,555.订的是180一间的商务大床间,不算便宜了,但是房间很小,设施感觉旧旧的.我住过很多连锁酒店了,如家也住过很多次,唉,发现如家是一家不如一家啊!遗憾.唯一方便的就是离重庆机场大巴站很近,第二天坐大巴很方便哦.补充点评 2007年12月23日 ： 对了,房间还有异味.我也觉得这已经是如家的习惯的.在深圳的如家也是有异味的.以后我想考虑别的连锁酒店了.住了成都的七斗星,感觉好很多!	n
这所酒店永不再采用。我于一周前透过携程预订好6月24日入住一天，竟然在入住当天中午从机场打车到酒店途中，收到携程短讯说：“您预订的6/24入住的杭州最佳西方梅苑宾馆,因政府征用,6/25早上8：30之前必须退房,请知晓”。向携程查询，回说他们也是当天才刚收到酒店的如是通知，而酒店前台亦无法解释为何会有如此安排。作为酒店住客，逗留至中午 12：00 是最基本的权利，如何能够临时用一个短讯便要求客人提早离开，真是荒谬，亦严重亏损了国际集团之名。怎晓得这酒店日后又会用政府名目亏待住客。虽然在跟酒店一番理论后，前台曾致电到我房间改说会为我特别安排下不用提早离开，这更令人生气，一方面房客要动气争取才给你基本的住宿权利，另一方面原来政府征用之说其实挺有弹性，不一定要执行。携程亦十分不是，怎能接受合作伙伴如此安排，如果酒店有活动不能出租应早作处理，不可能接受预定又出租房间的同时但牺牲客人的最基本的权利，这么晚替酒店发此短讯，而且亦未有主动为客人提供应变安排，只推说是酒店事情，与携程无关，令人难以接受。宾馆反馈 2008年8月12日 ： 回复： 尊敬的宾客：对此次不应该出现的错误，我们酒店深感遗憾；对给您带来的不愉快经历，在此真诚地表示道歉！衷心期待得到您的谅解和再次地支持！	n
跟住招待所没什么太大区别。绝对不会再住第2次的酒店！	n
房间布置是简约型的那种,床和被子都是廉价的感觉,空调极冷而且温度调节不灵, 只能睡前关掉, 但还是因此感冒, 早餐质量非常一般.以后不会再去了.	n
本以为携程推荐的错不了，而且房价是800，以为是比照四星打造的由几幢别墅的联合体，但去一看，失望到极点，只是私人承包的别墅，而且我用信用卡担保的房间竟然被人住好了，本想和CRRIP理论，但那老板还上路，跟我们协商，只是周六的房间的确紧张，只能接受，最后住到238号，交通太不方便，从皇后饭店开始得爬100个石阶才到。房间的卫生间卫生状况不行，水龙头还可以，是摩恩的。第二天的早饭，只有粥和淡馒头，鸡蛋还是限量供应的，小朋友是没有的，强烈建议去山上住莫干山山庄，去看过真不错，只是双休日估计房源会紧张。千万别住私人承包的别墅，第一次对携程推荐的星级产生怀疑。	n
1.收了包天的10元话费,却打不出电话;2.装牙刷的盒子是一个空盒子3.不提供购物袋	n
我个人对这个酒店感觉不好：1、硬件（1）这个所谓的酒店公寓好像有的层是客房有的是居民，我甚至看到有个人在电梯里牵了条大白狗！酒店无论院外还是楼门边都没有“海悦滨江酒店”之类的牌子，只能顺着门牌找，感觉非常不专业。（2）房间临街，早上实在太吵了，不用叫醒或闹钟，五点多准醒。（3）浴室有一道玻璃砖墙临街，非常冷。（4）早餐只有四种可选，量少，单点要40元/份！2、软件（1）工作人员素质实在太差，到了前台里面坐三个人，根本没人理我，直到我说有预定房间要住店。结帐非常慢，等了很多人，发票两天开成一天，一切都很不专业。	n
