房间虽然小但还是可以接受的，里面设施齐全，唯一给我的感觉是房间里都是镜子，老婆洗澡可以从各个角度看到，爽啊。唯一不好的就是交通不方便，我们每天在酒店门口乘小巴到九龙城才能换到地铁（价钱是4.7元），小巴11点多就没有了。行李可以免费寄存，不过要锁好。	p
房间比较大，就是马路噪音有点大，双层玻璃只要开一点点就受不了了。宽带1小时10块有点太黑了，这年头宽带还收费。以前也在西藏大厦住过，感觉前台服务比以前好些了。二楼的饭菜太一般了。整体还可以。	p
房间非常好，早餐还好，比较满意。房间缺少针线包，客房部人员反应速度比较快，再去沈阳还住高登。	p
真的很差!如果再去上海宁愿多花些钱也不住这儿.房间位置很好可以看到两面景色但房间内设施不算太好,我这人喜欢观察细节(在此之间住了两个酒店对比起来没想到这个这么差劲!)浴室用具不好,拖鞋只有一双质量不好(感觉像是住进了没星的酒店),我们是晚上8点多才由昆山回到上海前台小姐服务态度不好(这个我要强调一下!)下楼	p
沈阳市政府的酒店，比较大气，交通便利，出门往左就是北陵公园，环境好。	p
不错,住过几次了,值得推荐! 酒店外就有超市买东西挺方便的:)	p
入住喜来登前电话咨询过一些问题，礼宾部的ke接待不但接待了我，而且还为我的沈阳之行进行细致的安排并在前台留下了信息。在这里再次感谢。入住之后的感觉也很好。就是房间的排风扇声音太大，影响睡眠！	p
环境不错, 应该算CIXI那里比较好的酒店了. 性价比也还可以.	p
房间设施难以够得上五星级，服务还不错，有送水果。	p
酒店位置出行比较方便.中西早餐很丰盛,但收市时间9:30早了一点.豪华单间的房间还算不错,空间和设施摆设也合理.但房间部分设施稍显陈旧.补充点评 2008年2月29日 ： 补充一下,在房间内提供的网络连接线如同摆设,很短,根本用不上.由于我入往时间太晚,不想打扰服务员过来更换,只有搬出了自己出差常备的网络连接线使用了.	p
湖景房的景色很不错！酒店里面也收拾的很干净，就是设施稍旧了一些。交通很方便！厦门市的出租车太贵，从酒店到各景点坐公交车都很方便。 不过饭店的早餐很一般，选择比较少而且几乎每天都是重复的。	p
由于位置关系，一些时间不太好打到车，当然这不是酒店的错。	p
房间很大，交通方便。早餐还可以。下次去沈阳，还是住那。补充点评 2007年12月25日 ： 贵了一点，如果不是公司付账不会住那。	p
房间很干净，设施还行，家具稍微有些旧。商务间的楼层前台不错，不过清洁工很一般，住的时间比较长，好几次都没有放新拖鞋。不过4星里他家的价位算是比较低的了。	p
帮朋友订的，在上海来说价格是比较实惠的了。不过朋友住了后没有特别说很好也没有不满，呵呵！	p
服务应该再提升一下．怎么也要符合五星的标准啊	p
房间很好，符合五星级的标准。酒店离沟口及边边街都比较近，是去九寨沟旅游的最佳选择。补充点评 2008年7月21日 ： 地震对该酒店没有任何影响。宾馆反馈 2008年7月24日 ： 谢谢您的点评,欢迎下次下榻我酒店!我们将为您提供更周到的服务及优质的产品.	p
房间装饰不错也干净，环境也好，泳池水比较清洁，适合度假。	p
雅恬,只是房近出入口,有蚊子房,基本上一定的水平免费注册 网站导航 宾馆索引 服务说明 关于携程 诚聘英	p
朋友对该酒店的评价比较满意，就是交通非常拥堵。每次进出都要花费很长的时间。	p
还是很幽静，设施也不错，但是服务水平和以前几年比急剧下滑了，接线员和客房服务中心的服务极差，幸好我不是很在乎。	p
其它都可以但本次提供的房间不好窗户离墙只有几公分，应事先和客人打个招呼说明一下，否则很郁闷。	p
这是我经常住的酒店,主要原因是请我的客户来南京的,距离我公司很近,酒店本身还可以,价格涨了,但是酒店门脸不显著,不像是4星酒店.如果可以,加一点钱,就可以住中心大酒店了,很气派.距离国信200米	p
房间稍小，但清洁，非常实惠。不足之处是：双人房的洗澡用品只有一套.宾馆反馈 2008年8月5日 ： 尊敬的宾客：您好！感谢您选择入住金陵溧阳宾馆！对于酒店双人房内的洗漱用品只有一套的问题，我们已经召集酒店相关部门对此问题进行了研究和整改。努力将我们的管理与服务工作做到位，进一步关注宾客，关注细节！再次向您表示我们最衷心的感谢！期待您能再次来溧阳并入住金陵溧阳宾馆！让我们有给您提供更加优质服务的机会！顺祝您工作顺利！身体健康！金陵溧阳宾馆客务关系主任	p
运气不错,免费升级了,总体还是不错!房间比想象的大,由于是海景套房,所以风景很好!	p
国际酒店一向都是很好,住过很多四星酒店,我一直最满意的. 房价是很合理,除了牙刷洗发露,肥皂品质很好,房间视野很好,装饰和色调非常清爽,在工作忙碌中回到这家酒店的房间就感觉很舒服. 最近酒店换了新款式的牙刷感觉不是很好. 50楼的旋转餐厅也是观景很好,四楼酒吧有卖雪茄,二楼西餐有正中乳酪, 免费停车. 所有服务人员都很专业而且态度很好. 我外国人长住在中国已有10年了,除了牙刷,感觉是最好的酒店.	p
我是7-10号入住的豪华海景大床房，通过携程预定之前，曾给蓝天宾馆打过电话，当时是告知我没房了，我还比较郁闷。但是就抱着试试看的想法，在携程提交了一个订单，没想到居然给我发短信确认了！当时我还很是惊讶，因为我是带着宝宝去的，怕有误。后来到达威海后打电话给总台确认一下，告诉我预定没问题。这才放心下来。不愧是携程网友评价最高的酒店。服务比较好，还提前为我们准备好了婴儿床，整体服务员的待人接物都很礼貌热情。海景被前面的启明假日酒店破坏了一些，但还是不错的，躺在床上就可以看到海。早餐也不错，很丰富，有中式、西式、南朝鲜式，日式的。我个人喜欢西式的早餐，樱桃巧克力奶油布丁和蛋挞都不错，蛋挞还是冰过的，LP喝粥的时候小声跟我随便说了一句忘再拿个勺子了，服务员听到就给拿来，还主动为我的宝宝准备婴儿椅。我都想把早餐当午餐来吃了，哈哈。以后如果去威海度假，还住这里！提个小建议：晚报可以每天送一份，那东西不过块八毛的，我在广州住过酒店每天都给送羊城晚报。水果也可以每天送两个，一般出来玩一天回来的客人吃个桃子或小柿子还是很高兴的，成本也不过一两块，呵呵。补充点评 2008年7月11日 ： 忘记说了，第一天住在那里浴缸的下水阀似乎不严实，漏水比较快，导致我放的大半缸水漏下去不少，洗澡就只能边放水边泡澡，这就哗哗响而且不环保浪费水。第二天早上出去的时候跟服务员说了，晚上回来发现应该是处理过了，不漏了。服务还是比较上心的。但是后来，还是有些小漏，呵呵。宾馆反馈 2008年7月11日 ： 尊敬的宾客，您好，感谢您的留言！您提出的需求,我们将尽力满足，欢迎你提出宝贵的建议，也希望在您下次入住的时候为为您提供更优质的服务。	p
入住的是商务套房，虽然没有协程上写的72平米那么大，但是52平米的布局和装修等等都非常得满意。套房里还有免费软饮，免费洗衣(一定的金额内)，所以说还是物有所值。地方虽然不靠海，但是我住的32楼可以看到海，而且离青岛最有名的美食街云霄路可以不行，所以说虽然没有海边度假村的那么休闲，但是地理位置还是相当的不错。	p
第三次入住了，觉得还不错，正好碰上了地震，楼层低感觉不明显。希望四川尽快从灾情中恢复过来！	p
328单人间的性价比还不错，市中心闹中取静，交通方便，对面就是招商银行，隔壁是红旗连锁超市。早餐也还丰富，但是有人在自顾自地拍卖国画，尽管没人理他们。承接会议较多，电梯比较繁忙，晚上睡觉还是安静的。总机对外来电话盘查严格，没有骚扰。虽然属于四星中一般的，但是看在价格和上述各个方面，蛮合算又舒适的。	p
房间设施比较旧，餐饮贵，服务不错，没有任何景观。外观比狮林好点	p
1.房间设施看得出来是比较久远了，但非常非常干净，润肤霜、沐浴露和洗发膏质量都不错，比很多5星要好，且味道很好闻2.地理位置就是坐落在商业中心，【强烈推荐】出了酒店大门往左绕到酒店后面的小路上，有一家【章鱼小丸子】，他家的鸡肉串和小丸子非常好吃，只是门面非常小，生意非常好。	p
房间小,感觉卫生不太好,整个环境显的很陈旧.服务一般.	p
老酒店翻新，总体来说还可以，性价比比较高	p
确实很有商务型酒店的特点,但是缺乏周到的五星的服务.	p
比去年有较大的进步，尤其服务方面。毕竟加入了最佳西方的管理体系。早餐不错	p
4月3日4日住了两天，266元/天包双早，携程的价格一般，前台也能拿到。酒店地理位置很好，步行到个园和瘦西湖都10分钟。早餐也可以，唯一的问题是隔音太差，隔壁房间的动静都听得清楚	p
房间整洁，有电脑可以打游戏和上网:-) 空调声音有点大，此外一切都好。室内所有收费项目上面都有价签，很公道!我的手机充电器插头制式不一样，房间服务先后送来充电器和装换器，很有效率。自助早餐也不错的。就是临近苏锡路老城区，周边有点乱。	p
位置好!性价比好!环境好!缺点是较旧.	p
作为经济型连锁酒店，我觉得锦江之星要比如家、莫泰等高出一筹。最明显的就是房间本身够宽敞，厕所也不局促，马桶还是加长型的呢。10元的早餐算丰富的。整个酒店的色泽和基调看着舒服，如家就土点。	p
准四星已经正式挂牌为四星了,房间很大很干净,服务也不错,酒店就在火车站旁边,交通很便利,而且大商等大商场立着也不远,购物也挺方便,不过也正因为在火车站旁边,酒店门口显得比较乱	p
仅住了一天，单人房，感觉还满意。服务不错，早餐不错，结账也很快。去不远的西关人家吃了顿晚饭，驴肉锅仔，便宜又实惠。房间稍小了一点，书桌上放了电脑稍显拥挤。	p
花园环境还好，早餐也不错。晚饭时间车位很紧张，只能停篮球场。卫生间设施比较陈旧，洗手盆有裂痕。“请带我回家”的红色小卡片上没有印任何地址或地图，奇怪。房间里有酒店内部报赠阅，时间早的是第19期，晚的那份却是第2期，有点莫名。	p
从地段,星级,价格,环境和设施考虑,此酒店相当不错.如果没有其他因素,下次还会再住.为使贵酒店良性发展,特提醒几点:1.酒点总台服务小姐不够专业,没有职业笑容.2.房间(1117)水龙头和下水出问题,有人报修和管理吗?这牵涉到资源,成本,信誉和服务.3.空调整夜发出流水的噪声(分贝可能不小于50),可能会影响许多客人的休息.希望下次来住时得到改观.	p
6月在云南经贸宾馆住了两天豪华房,是淡季. 用了酒店接机服务和早餐. 接机的小姐非常乐心的介绍了昆明和宾馆周围环境.早餐很丰富. 房间很干净. 服务很好. 离市中心很近.	p
朋友告诉我，是目前肇庆最好的酒店。值得期待的，因为酒店够大， 中餐厅出品不错，房间设置还好，看得出酒店的江湖地位。说说要商榷的地方。370元的房价，按要求付了800远的按金，顺利入住。晚上在大堂吧喝了点东西，半夜一点买单95元人民币，以为可以签单，被告知不行，除非在前台另开消费卡。 当晚的部长挺客气的，为我和前台沟通，结果可以登记我的入住按金收据号码然后签单。结果我正在洗澡的时候，电话响了，是前台，他们改变主意了，一定要我到前台开一张消费卡，哎哟！ 我只好答应我洗完澡后下楼去开一张消费卡。当我正准备穿衣服的时候，电话又响了，说不用了！ 谢谢！ 我真的要睡觉了。第二天，我们办好了check out, 到中餐厅吃饭，结果先生有点不舒服，于是我们又重新登记入住，这回，前台也没有问我们是否需要消费卡，只是收800大元按金。当晚，两公婆又在大堂吧喝点东西，打烊时，问是否可以签单，当晚的服务员是这样回答的：“今天晚上你必须付现金！” 我早有准备，赶紧拿出65元买单。我发现，这里很多曾千年雪封过的俊男美女服务员，缺少服务行业的职业微笑和礼貌，很纳闷，怎么这里的服务员都不会说“请”“谢谢”等行业用语， 虽然，旁边华侨大厦是的装修已经旧一点，但那里餐厅推车仔的阿姨给你端上凤爪、排骨、叉烧包，在你的单上盖印的时候，也微笑说一声“谢谢”，在走廊服务员遇到客人也会说一声“早上好”。	p
5.1期间在这住的，位置还可以，在市委市政府附近，要去商业区和步行街得打车，屋里有蚊子，虽然空间挺大，晚上熄灯后把窗帘拉上简直是伸手不见五指，很适合睡觉，但是会被该死的蚊子吵醒！打死了两只，第二天早上还是发现又没打死的，卫生间挺大，但是设备很老旧。	p
升级之后的商务单人间A房间很不错，超大的床，睡起来很舒服。是从火车站对面的时代广场换过来的，所以相比而言，这里的环境也要好很多。在那边一路上都有人问我：“住宿不，小伙？”（小弟看起来好像年纪很小啊#_#）也要提一个不爽的事，尽管后来解决了，但还是得为后来的各位提个醒。预定的时候，携程上面的资料写着“商务单人间内配有电脑”，然后预定列表里有商务单人间A和商务单人间B两种。我就想当然地认为便宜的那种B型房也有电脑。（经过这次向携程咨询，携程上面的信息已经更正过来。）入住首先发现B型房没有。这是小事，除了这点，也推荐各位不要选择B型房。房间很小，基本相当于没有窗户，有一扇不透光的窗户，但是你基本不能打开。打开之后，首先眼前看到的是六楼的楼顶，然后楼顶上是几个卫星电视的大锅，一个哄哄响的中央空调。把窗户关紧，中央空调的声音也很清楚，估计半夜的时候会影响睡觉。这个房型是在七层，不知道是不是违规建的，很多东西都不正常，电梯只通到六层，要走一层楼梯才能上去，这一层好像也很少有人住。当然，后来携程和酒店的解决还是满意的：给升级到A型房。服务没太多接触。但是有一个比较好玩的，因为酒店二层是一家叫大连渔港的海鲜饭店，所以每到吃饭的时候，一层电梯口都站一排MM，看见有人来就热情地问你到几楼，并作势帮你按电梯，如果说到二层，则会一路陪伴你上去用餐；如果说其他客房楼层，就对你没啥兴趣了，伸出来按电梯的手也缩回去了。	p
这家酒店基本上是我的常住酒店，干净离我要办事（中环）的地方很近，如果是早上我通常走半山自动扶梯下去，大概20分钟。如果不想走路，他们也有专车接送，不过时间不一定能match自己的schedule。打车从中环上来，也就是20~25港币。省点钱的话，到怡和大厦坐12路车也可以到门口。服务员很sweet，特别是一个叫Angel的女孩，很耐心。只有一次我要求的是双标房，实在震撼，放下行李，基本上我一家三口就不能走动了。比我小时候的房间还小，于是我马上要求换房，当然upgrade是要加钱的。海景套房是不错的，位于半山，夜景一流。他们还有专车接送去赤柱，海洋公园和山顶缆车站。我们省了一笔路费和时间。他们还有自己的小餐厅，东西还挺好吃分量也足，午饭有任食的soup和甜品。下午茶就更便宜了。在中环的地头，这个价钱也只有这家了。我们从山顶下来后是走回家的，也就是半小时左右，经过兰桂芳。沿着自动扶梯，有很多小食店，吃东西还行，有几家开得很晚，半夜了有很多客人。还有一家叫莲香楼的很老很老字号。	p
国庆住了几天，总的来说还可以。交通：应该是很方便，紧挨着三环，离光熙门城铁站特近，步行不到10分钟，就是路不好找，城铁附近正施工，携程短信上的地址严重失误，什么城铁站向北十五米，害我找了好几圈，所以最好向路人打听。住房：厕所比较小，但很干净，卫浴也不错“箭牌”，热水很足。室内装修简介明快，就是墙皮该刷了，很多都脱落了，床一般有点硬，能感觉到弹簧，不过我比较喜欢睡硬床。服务：相当一般般。吃饭：附近吃饭地点还是很多的，蟹老宋、全聚德、羊蝎子等等。。	p
火车晚点,临时改主意去住店,也没有刻意去选择.不过衢州饭店还不错,就是凌晨checkin,前台也要算前一天,收全天房费,说携程预订就是这样,睡了几个小时赶火车,还花了一天的钱.	p
环境还可以，房间不大但也不是太小，够住了。写字桌前的落地灯离得太近了，每次移椅子都会碰到，另外有一点就是隔音效果不好，夜间车子路过的声音有点吵，其它的还行。	p
08年2月份入住的大床房，非常满意。的确是5星的水平，当时的价格也低。下次有机会还会去。	p
订的标准间，但免费升级为行政间，不错。酒店环境不错，服务也很好。但酒店门口的停车场竟然要收费，感觉很不好，第一次碰到这种状况，希望下次去，住店的客人能够免费，不是因为20元的原因，是因为你们是五星级酒店，自然应该有真正五星级的服务。	p
特别感谢工号0649的崔小姐（手机号136134462**），下次到太原出差一定要当面感谢她的。我是4月10号入住的，11号一早赶班机，把一条项链丢在了客房，直到回家都没有发现，还是崔小姐主动打电话和我核实，而且自己掏钱帮我寄了回来，并且多次去邮局帮我查询，这种精神太难得了。非常感谢！酒店门前确实有黑车，本来对酒店印象很一般的，但有这样的员工很让人感动。下次去太原一定还会入住的！	p
第一次入住该酒店.开始感觉很好.后来发现空调不冷.原来是单个房间的一个送冷风扇不转.虽然维修比较急时,我已经在只有通风冒汗的房子里住过一天了.但是我认为这应该是酒店的问题,他们应该要适时订期检查.我入住时正好碰上酒店中餐厅装修.停业三天,可没有事先通知.也没任何提示.当我们到了才知道,结果又得重新安排变更用餐地点.还好客人比较熟.否则会带来许多不便.希望酒店能改善这方面的服务.设施方面建议将电视机改变一下.宾馆反馈 2008年6月11日 ： 感谢您的宝贵意见，您提出问题确实是我们工作的失误。对于您在入住时给您带来的不便我们深感歉意，您提出的意见和建议我们会及时的改正，欢迎您下次入住！	p
非常不错的酒店，房间宽大，浴室的设计都不错，只是房间里的酒水设备不足。我从加州带来几瓶很好的红酒，可是没有杯子，不过酒店马上就送过来。客房，门房的服务都很好。在大连的五星酒店里这家的价格合理（可是还是比我在北京住的五星酒店贵）。我住过大连其它的五星酒店，这家日光比较划算。	p
很好，还会再次入住。晚上有钢琴演奏。。。	p
应该是济南最好的酒店了，不过从档次上来讲房间不够大，没有自带的商场是很大的遗憾！	p
从携程网上看到大家对海景花园的服务评价很高.我们于7月下旬到青岛避暑，特意入住该店。入住5天感同身受，果然名不虚传。可以说在我们住过的宾馆里服务是一流的。有几处尤其让我很感动。比如，西餐厅主管王杰和服务员金玉盛听说我有胃病，除了在进餐时照顾我，还给我拿来一些生花生米，说每天吃几个可以保护胃黏膜。我爱吃青菜，每次都单独给我炒一小盘。我们到青岛的那天下着雨，客户关系主任直接送我们进房间，在房间里办了入住手续。他在登记时看到我脚面上贴着膏药，很快让楼层服务员给我送来几张云南白药膏。后来蓝吧服务员也注意到我走路一瘸一拐，又给了一盒膏药。我贴后基本痊愈。我有慢性咽炎，进了空调房就咳嗽。大堂服务员马上给我取来金嗓子喉宝，蓝吧服务员又拿来咳嗽糖浆。我服用后很快见效。楼层服务员总是在我们外出后收拾房间，每次回来房间总是整整齐齐的，晚上还送来牛奶。这可是我们在外旅行从没有接受过的待遇。我们走进酒店，见到的员工都微笑打招呼，让人感到很亲切。我还注意到，酒店提供的早餐食品，给房间送的水果和小礼品，质量都比较好。所有这一切都说明酒店总经理管理有方，把这么多的员工培养得如此之好，让他们树立顾客至上理念，提供人性化服务，殷勤，热情，细致，周到，这是很不容易的。其实，作为五星级酒店，该店硬件并不很理想。但是。他们超一流的服务的确吸引了顾客。我们明年避暑还是首选青岛，到青岛住店当然还是首选海景花园.	p
早点还可以，酒店环境很好。不过丁山楼还是和主楼有很大的差距	p
2月春节时去住才288元，现在五一长假预定居然要388元，不知道这100元是酒店的原因还是携程的原因而大幅上涨？过节涨价的理由是不存在的，因为春节都没有涨价。	p
价格实惠，基本还可以宾馆反馈 2008年4月17日 ： 希望下次再入住本酒店。	p
去郑州好几次，都在这里住。有一次免升，住大堂左侧一层的房间。酒店很安静，服务也好。前台小姐虽然不漂亮但服务很到位。退房速度极快。下飞机来酒店时免费班车，退房后去机场要付费。下次来就住这里。	p
春节期间预定，房间硬件设施很好，早餐也比较丰盛，服务态度等各方面符合酒店星级标准，除了地段在浦东外，可能不适合外出观光，商务或访亲时入住是非常好的选择。	p
对于行政套房这个级别来说,房间小,卫生间设施过于简单.在窗户底下有大楼的中央空调的排气管,造成开窗后废气进入房间.行政楼层的行政酒廊看起来很简陋补充点评 2007年11月5日 ： 大堂看起来很漂亮,房间的窗户外的景色很好,不错的自助早餐,较快的网络速度	p
性价比不错，我是住的东晖楼商务房，早餐也不错，门童不是很主动，押金是我住过的酒店里最高的，大堂主管很好，现在没带够，卡的密码又输错，导致押金交不足，主管帮我签了个字，舒心	p
总体感觉很不错，酒店的地理位置很好，出行很方便，而且对面就是市政府，景观效果很好，房间面积也很大床很舒服，整个房间给人的感觉很干净、舒适，最值得一提的是酒店的服务，每个服务人员都让人觉得很亲切，因为我带个小孩子，吃早餐时服务人员对我们的照顾更是无微不至，真的很感动，下次来威海我还会选择该酒店，不错不错补充点评 2007年9月9日 ： 还得补充一点，退房时相机落房间了，服务员能及时送还，值得表扬	p
不错的地方,性价比较高,有机会还会住,呵呵.	p
房间是新装修的,用的是浅色调,感觉很温馨,布局较合理,显的比较宽敞.酒店选用的布草很讲究,放在手里感觉到厚实,柔软.服务周到,特别是本人出差带的衣服较多,服务员可以考虑客人的实际需要,随时增加衣架.酒店的饭菜做的有特色,去过不同的楼层,都是满意而归.虽然酒店在细节上有过人之处,但如果在某些地方再改进一下,完全可以和当地的四,五星酒店媲美,如卫生间放置小挂钩可以挂	p
离火车站、汽车站较远，不利于自助游！但酒店的环境和服务还是不错的......	p
酒店还是非常的不错，我预定的是套间，服务非常好，随叫随到，结帐非常快。顺便提一句，这个酒店三楼是一个高级KTV，里面的服务小姐非常的漂亮，有机会去看看。	p
